Cotidiano: Coronavírus | Folhawww1.folha.uol.com.br › cotidiano › coronavirus	https://www1.folha.uol.com.br/cotidiano/coronavirus	UOL - O melhor conteúdo ... Número de mortos pela Covid-19 no Brasil passa de 70 mil ... Estudo britânico alerta para danos cerebrais do coronavírus.
Porto Alegre fechará shoppings, comércio de rua e ...www1.folha.uol.com.br › cotidiano › 2020/06 › porto-...	https://www1.folha.uol.com.br/cotidiano/2020/06/porto-alegre-fechara-shoppings-comercio-de-rua-e-construcao-civil.shtml	23 de jun. de 2020 - UOL - O melhor conteúdo · BUSCA · BATE-PAPO · EMAIL ... Contra coronavírus, Porto Alegre vai multar idosos em parques e praças ...
Folha Ao Vivo - Acompanhe todas as informações sobre ... - Uolaovivo.folha.uol.com.br › equilibrioesaude › 2020/03/30	https://aovivo.folha.uol.com.br/equilibrioesaude/2020/03/30/5911-acompanhe-todas-as-informacoes-sobre-a-pandemia-de-coronavirus.shtml	26 de jun. de 2020 - Os dados sobre mortes e casos de Covid-19 são fruto de colaboração inédita entre Folha, O Estado de S. Paulo, Extra, O Globo, G1 e UOL ...
Folha Ao Vivo - Acompanhe todas as informações sobre ... - Uolaovivo.folha.uol.com.br › equilibrioesaude › 2020/03/12	https://aovivo.folha.uol.com.br/equilibrioesaude/2020/03/12/5888-acompanhe-todas-as-informacoes-sobre-a-pandemia-de-coronavirus.shtml	26 de jun. de 2020 - UOL - O melhor conteúdo ... Acompanhe todas as informações sobre a pandemia de coronavírus ... Para a Itália, país mais atingido do mundo pela crise de coronavírus, a entidade ... Fale com a Redação · Mapa do site ...
Folha de S.Paulo: Notícias, Imagens, Vídeos e Entrevistaswww.folha.uol.com.br	https://www.folha.uol.com.br/	Siga a Folha e fique informado sobre tudo o que acontece no Brasil e no mundo. Notícias sobre política, economia, cultura, esporte, entretenimento e mais.
coronavírus - Folha Tópicos - Folha de S.Paulom.folha.uol.com.br › folha-topicos › coronavirus	https://m.folha.uol.com.br/folha-topicos/coronavirus/	UOL - O melhor conteúdo ... Folha Tópicos. Monday ... O Brasil já superou a marca de 70 mil mortos pelo novo coronavírus e, por bem pouco, o empresário.
Últimas notícias - Folha de S.Paulom.folha.uol.com.br › ultimasnoticias	https://m.folha.uol.com.br/ultimasnoticias/	2 dias atrás - UOL - O melhor conteúdo ... do governo Bolsonaro · Cotidiano 12h00 Brasil não consegue por em prática promessas de testes de coronavírus ...
Agora São Paulo | Agoraagora.folha.uol.com.br	https://agora.folha.uol.com.br/	UOL - O melhor conteúdo ... Acompanhe as últimas notícias sobre o coronavírus ... Porteiros são essenciais para prevenir a Covid-19 nos prédios. Profissionais ...
UOL Notícias - Home | Facebookwww.facebook.com › Places › São Paulo, Brazil	https://www.facebook.com/UOLNoticias/?pageid=124493634232128&ftentidentifier=4469915176356597&padding=0	UOL. Media/News Company. O Globo. News & Media Website. Folha de S.Paulo ... June 8 ·. Parceria entre UOL, O Estado de S. Paulo, Folha de S.Paulo, O Globo, G1 e Extra é uma resposta à decisão do governo Jair Bolsonaro de restringir o acesso a dados sobre a pandemia de Covid-19 ... noticias.uol.com.br.
Bioética e COVID-19 - Resultado da Pesquisa de livros Googlebooks.google.com.br › books	None	... nada, diz Bolsonaro ao minimizar coronavírus. Folha de São Paulo, Caderno Poder, 26 mar. 2020. Disponível em <https://www1.folha.uol.com.br/pod ...
